TITLE,BODY,URL,SECTION
Ecuador: caída de importaciones impulsó crecimiento económico en el primer trimestre,https://www.infobae.com/movant/2024/06/29/ecuador-caida-de-importaciones-impulso-crecimiento-economico-en-el-primer-trimestre/,"La reducción de las importaciones en 3,3% empujó a que la economía de Ecuador creciera levemente un 1,2% en el primer trimestre de 2024 respecto al mismo periodo del año pasado, según explicó este viernes el Banco Central del Ecuador (BCE).
El crecimiento económico también se debió a “una variación positiva de las existencias (inventarios)”, añadió el BCE en un informe sobre el desempeño de la economía nacional en el primer trimestre del año.
Sin embargo, remarcó que los principales componentes del Producto Interior Bruto (PIB) presentaron contracciones interanuales, sobre todo en el rubro de gastos del Gobierno central, que presentó un indicador negativo en un 0,3%.
Entre enero y marzo de este año también se contrajeron las exportaciones en 0,5%, el consumo de los hogares en 1,1%, y la formación bruta de capital fijo (inversiones) en 1,3%.
Sobre la reducción de las importaciones, el Banco Central explicó que dicho comportamiento se debió a “una contracción de la demanda en los productos refinados de petróleo, vehículos y equipos de transporte”. Además, señaló que el “consumo de los hogares se vio afectado por la disminución de la demanda de los servicios de comercio y de transporte”.
También, la reducción de gastos del Gobierno “se sustentó en una disminución en sus servicios administrativos”, añadió la fuente, tras recalcar que el comportamiento negativo de las exportaciones se debió “principalmente a menores ventas al exterior de camarón (gamba) elaborado”.
La variación en el apartado de las existencias contribuyó positivamente al PIB “por una alta acumulación de los inventarios por parte de las empresas durante los primeros tres meses de 2024 en comparación al mismo periodo del año anterior, debido a las contracciones de la demanda interna y externa”, agregó el Banco Central. Eso se debió a que, a nivel de industrias, solamente diez de los veinte sectores que integran el apartado presentaron un desempeño positivo.
Sobre todo han destacado los sectores del suministro de electricidad y agua, en 12,5%; la pesca y acuicultura, en 10,8%; la explotación de minas y canteras, en 4,3%; las actividades profesionales técnicas, en 3,9%; y las actividades inmobiliarias, en 2,9%.
Con relación al trimestre anterior (el cuarto trimestre de 2023), el PIB de enero a marzo creció en 3,5%, impulsado por la recuperación de exportaciones en el 10,6%; mientras que la acumulación bruta de capital aumentó en 3,1%, agregó el BCE.
Asimismo, dijo que la variación del primer trimestre de 2024 en relación al último del año pasado en el rubro de consumo de los hogares mejoró en 2%; mientras que las importaciones decrecieron en 10,2%, “contribuyendo positivamente a la evolución del PIB”.
Además, señaló que el gasto del Gobierno entre enero y marzo pasados decreció en 0,3% respecto al último trimestre de 2024, y que se reportó una desaceleración en la acumulación de las existencias de las empresas, “contribuyendo negativamente al desempeño del PIB”.
Las autoridades de Perú impulsan la pesca sostenible en la Reserva Nacional Mar Tropical de Grau, que se creó en abril pasado en una zona marítima fronteriza con Ecuador, como parte de las medidas de conservación de la naturaleza y el impulso de la reactivación económica del país, afirmó el ministro del Ambiente, Juan Carlos Castro.
El Gobierno de Perú aprobó el pasado 25 de abril la creación de la Reserva Nacional Mar Tropical Grau, que comprende una extensión de 115.675,89 hectáreas marítimas en una de las zonas con más alta biodiversidad del litoral peruano, frente a los departamentos norteños de Tumbes y Piura, fronterizos con Ecuador.
Las autoridades peruanas señalan que la reserva comprende una de las zonas de sustento alimenticio para el país, ya que 24 de las 35 principales especies de peces óseos desembarcados por la flota pesquera artesanal peruana tienen origen en Piura y Tumbes.
Entre los beneficiarios directos figuran más de 9.500 pescadores artesanales y se estima que también se obtendrán unos 4,74 millones de dólares por actividades de avistamiento de ballenas, a los que se sumarán los recursos generados por servicios de provisión de alimentos, recreación y turismo.
Nuevo
",home
Chile explora nuevas oportunidades en México tras actualizar el TLC,https://www.infobae.com/movant/2024/06/29/chile-explora-nuevas-oportunidades-en-mexico-tras-actualizar-el-tlc/,"“Con México en particular estamos cumpliendo 25 años del Tratado de Libre Comercio (TLC) que ha facilitado muchísimo todas las exportaciones y el comercio bilateral con cifras muy interesantes, entonces ahí hay muchos fundamentos para poder estar aquí en México”, señaló Lorena Sepúlveda, directora nacional de ProChile.
Antes de la inauguración del Encuentro Latam México 2024, uno de los eventos más destacados de América Latina en los ámbitos empresarial, tecnológico y cultural, la directiva destacó que estas reuniones tienen como objetivo fortalecer el comercio y ofrecer nuevas oportunidades.
“Estamos tratando también de ser un poco más innovadores y salir de lo tradicional en cuanto a los alimentos, que normalmente acá en México nos conocen muy fuerte por el vino, por la fruta, incluso por los productos del mar, pero también hay otra oferta que estamos mostrando y que tiene que ver con tecnología con innovación”, expuso Marcelo Sobarzo, agregado comercial de ProChile en México.
El evento, organizado por ProChile, una entidad del Ministerio de Relaciones Exteriores de Chile, se realizó en Guadalajara y Ciudad de México. Su propósito fue consolidar los lazos comerciales entre ambos países y otras zonas de América Latina.
“Buscamos ampliar esta mirada que tienen de Chile. Hay una oferta mucho más complementaria y que tiene que ver también con mostrar todo lo que tiene que ver con alimentos e innovación alimentaria”, señaló Sobarzo.
El evento contó con la participación presencial de más de 75 exportadores y 110 importadores provenientes de seis estados mexicanos, así como de Colombia, Costa Rica, Panamá, Guatemala, Uruguay y República Dominicana.
“Esperamos que con este evento que estamos haciendo aquí en México, se gire un poquito más hacia el lado de Latinoamérica. Actualmente, su comercio es casi el 85% con el T-MEC (Tratado México, Estados Unidos y Canadá) y obviamente eso queremos ir cambiando, que vayan diversificando y que miren a Chile también como un socio estratégico importante”, señaló Sobarzo.
Por su parte, Sepúlveda destacó las oportunidades de Chile en México. “Chile tiene una oferta en el sector de la animación audiovisual de videojuegos. A raíz de todas las ferias que se hacen de este sector de economía creativa, tiene también una presencia aquí muy importante”, indicó.
El evento también contó con la participación de la Subsecretaria de Relaciones Económicas Internacionales de Chile, Claudia Sanhueza; la Embajadora de Chile en México, Beatriz Sánchez; y la canciller mexicana, Alicia Bárcena.
“Con esta modernización del Tratado vamos a tener una oportunidad muy importante de reavivar a las comunidades empresariales y a industrias del futuro”, señaló Bárcena.
Después de 25 años de la implementación del TLC entre ambos países, el intercambio comercial alcanzó los 3.435 millones de dólares en 2023, con un crecimiento promedio anual del 3,9 %, según el Ministerio de Relaciones Exteriores de Chile.
Las exportaciones chilenas a México aumentaron de 500 millones de dólares en 1998 a 1.751 millones en 2023, mientras que las importaciones desde México a Chile crecieron de 847 millones en 1998 a 1.684 millones en 2023.
En 2023, México se convirtió en el principal destino de las exportaciones chilenas de abonos minerales, duraznos en conserva, cartulinas multicapas, tableros de partículas de madera, queso gouda, ajos frescos y cápsulas fulminantes para la minería, entre otros productos.
Nuevo
",home
"Paso internacional: tras 20 días de cierre, ¿se podían minimizar las pérdidas y complicaciones logísticas?",https://www.infobae.com/movant/2024/06/28/paso-internacional-tras-20-dias-de-cierre-se-podian-minimizar-las-perdidas-y-complicaciones-logisticas/,"El Paso Internacional Sistema Cristo Redentor, arteria logística vital para el tránsito de los vehículos de carga que circulan desde Argentina hacia Chile, muchos de los cuales provienen de otros países limítrofes como Brasil o Paraguay, lleva más de dos semanas cerrado debido a los grandes volúmenes de nieve caída que bloquea las rutas del paso.
Las problemáticas derivadas de esta situación son múltiples y complejas. La interrupción del abastecimiento, según informan productores locales argentinos, ya está produciendo del lado chileno quiebres de stock de diversos productos que el país trasandino importa, a la vez que miles de conductores se encuentran varados a ambos lados a la espera de poder transitar, sumando días de ausencia en sus hogares y sufriendo los rigores de la situación, más allá de que cuentan con el apoyo y la asistencia de las autoridades a ambos lados de la frontera.
Desde luego, nada hay que objetar cuando se trata de brindar seguridad ante las inclemencias climáticas a todos los que por allí transitan. Sin embargo, especialistas del sector del transporte terrestre internacional, señalan que existen varios aspectos que, desde una mejor gestión, podrían mejorar considerablemente esta problemática.
El cuadro de situación tras veinte días de cierre, es de alrededor de casi 3.000 camiones varados en Mendoza, tanto en diversos paradores en las cercanías del cruce como esperando salir de diversas empresas de transporte de la provincia. 
Pero, a la vez, existe un número indeterminado, pero sin dudas muy relevante de camiones que se encuentran detenidos en diferentes puntos del país y de las fronteras con Brasil, Uruguay y Paraguay, muy lejos del cruce mendocino de Cristo Redentor, por un tema netamente normativo.
“LOT38″ es el nombre que la Aduana le asigna al punto operativo Mendoza, así como el punto de salida Uspallata “40111″. Ante el cierre del cruce fronterizo Cristo Redentor, actualmente la Aduana bloquea estos puntos operativos lo que impide el paso de camiones con destino a dicho cruce, incluso negándoles el cruce por otros puntos fronterizos. 
De esta forma, los camiones no pueden hacer Aduana ni ingresar al país, literalmente, no pueden hacer nada. 
Esto genera el gran perjuicio de que estos vehículos no pueden ni siquiera acercarse a la zona. Daniel Gallart, Director del Departamento de Transporte Internacional de la Federación Argentina de Entidades Empresarias del Autotransporte de Cargas (FADEEAC), señala que esta modalidad, “es absolutamente perjudicial para nosotros, porque en lugar de poder estar parados a, por ejemplo, 200km del cruce internacional, los camiones quedan detenidos en frontera, a 1.000 o 1.500km de distancia. Esto hace que cuando se habilita el paso, los camiones deben sumar un día y medio a su tiempo de viaje hasta llegar a la zona del cruce”.
Además, el especialista destaca que, de acuerdo a las condiciones climáticas, el paso podría haber estado al menos dos días abierto aprovechando la ventana de buen tiempo que se registró durante este periodo de cierre, 48 horas en las que podrían haber cruzado entre 800 y 1.000 camiones. 
Por último, también destaca que, en los países nórdicos, los trabajos de limpieza con motoniveladora de las rutas comienzan cuando se acumulan solo diez centímetros de nieve, en lugar de esperar los enormes volúmenes que se deben remover actualmente en las rutas tanto argentinas como chilenas.
En conclusión, mediante un mejor trabajo coordinado entre las autoridades de ambos países y optimizando la gestión aduanera, el especialista de FADEEAC considera que se podrían minimizar los fuertes perjuicios de la clásica temporada invernal de anegamientos en el cruce internacional más relevante para el comercio exterior entre Argentina y Chile.
Nuevo
",home
La Unión Europea busca reducir dependencia de importaciones en áreas sensibles,https://www.infobae.com/movant/2024/06/28/la-union-europea-busca-reducir-dependencia-de-importaciones-en-areas-sensibles/,"La Unión Europea (UE) priorizará en el próximo lustro mejorar su seguridad económica y reducir su dependencia de terceros en “sectores sensibles” y “tecnologías clave para el futuro” como defensa, espacio, productos farmacéuticos, químicos, biotecnología o inteligencia artificial.
La agenda estratégica 2024-2029 aprobada este viernes por los jefes de Estado y de Gobierno de los Veintisiete consagra el refuerzo de la competitividad y la autonomía europeas como prioridades después de que la pandemia y la guerra en Ucrania las hayan elevado al centro del debate durante la última legislatura.
Ambas crisis pusieron de relieve los riesgos de la exacerbada dependencia del bloque europeo para procurarse suministros esenciales - desde mascarillas hasta semiconductores pasando por gas natural- en un contexto de tensiones geopolíticas y aumento del proteccionismo, empujando al bloque europeo a apostar por políticas de impulso a la producción local y diversificación de proveedores destinadas a continuar.
“Reforzaremos nuestra seguridad económica, reduciremos dependencias perjudiciales y diversificaremos y aseguraremos nuestras cadenas de suministros estratégicas, incluyendo con el refuerzo de nuestra seguridad marítima”, dice el documento, que llama también a aumentar la “capacidad propia en sectores sensibles y tecnologías clave para el futuro”.
Los líderes citan como áreas prioritarias para el próximo lustro la defensa, el espacio, inteligencia artificial, tecnología cuántica, 5G y 6G, semiconductores, tecnologías de emisiones cero, movilidad, sanidad, productos farmacéuticos, químicos y materiales avanzados.
Todas ellas forman parte de los sectores dónde la UE ha identificado desde hace años dependencias que, en algunos casos, son de naturaleza estratégica por su potencial impacto en áreas críticas para el continente como la seguridad, la salud o la transición ecológica.
Los Veintisiete han multiplicado sus acciones en los últimos años para reducir estas dependencias con iniciativas que pasan por aumentar la producción en territorio europeo, diversificar proveedores, hacer compras conjuntas, relajar las normas para permitir más ayudas públicas o incentivar los consorcios con el sector privado en sectores estratégicos, entre otros.
Es el caso de la Ley Europea de Chips, que busca duplicar la fabricación local de semiconductores para que la UE represente en 2030 el 20% del mercado global, o la de Industrias de Emisiones Cero, que aspira a aumentar la producción europea de tecnologías limpias hasta cubrir el 40% de la demanda y competir así con los subsidios masivos de Washington y Pekín a este sector.
Según un informe publicado por la Comisión Europea en 2021, la UE tiene una “alta dependencia” de terceros países para el suministro de 137 productos en sectores sensibles (equivalentes al 6% del valor de sus importaciones), sobre todo de China, origen de más de la mitad de estos productos, seguida de Vietnam (11 %) y Brasil (5%).
Siete de cada diez de esos productos se usan en sectores con alto consumo energético, como materias primas o sustancias químicas, aunque también hay grandes dependencias en el sector sanitario y en bienes relevantes para la transición ecológica y digital, como hidrógeno o chips.
La UE, por ejemplo, solo produce el 1% de las materias primas que necesita para las baterías de litio, turbinas eólicas o motores de tracción eléctrica. Obtiene de China un 98% de las tierras raras y el 93% del magnesio, de Turquía el 98 % de su borato, y de Chile el 78% del litio, todos ellos esenciales para casi cualquier tecnología.
Los Veintisiete fabrican el 24% de los ingredientes farmacéuticos activos del mundo, frente al 66% que representan juntas India y China, y compran al gigante asiático un 45% de los que importan.
En defensa, un sector en el que apenas ha habido proyectos comunes hasta la invasión rusa de Ucrania, el gasto ascendió a 240.000 millones de euros en 2022, cerca de los 275.000 millones que destinó China, pero casi el 80% de los equipos militares que adquirió los compró a países extracomunitarios.
Nuevo
",home
Se reactiva el mercado inmobiliario rural,https://www.infobae.com/revista-chacra/2024/06/27/se-reactiva-el-mercado-inmobiliario-rural/,"La actividad en el mercado inmobiliario rural alcanzó en el mes de mayo el pico más alto de los últimos 10 años, de acuerdo con el relevamiento que realiza mensualmente la Cámara Argentina de Inmobiliarias Rurales (CAIR).
El Índice de Actividad del Mercado Inmobiliario Rural (InCAIR) en el quinto mes del año resultó de 48,30 puntos, resultando el pico máximo de 2024 y el más importante de la última década.
Este índice refleja la actividad del mercado inmobiliario rural en todo el país, y su base es de 97,5 puntos, que corresponde al pico máximo registrado en septiembre del 2011.
El InCAIR se conforma, principalmente, por los resultados de la encuesta mensual de actividad; la cantidad de avisos publicitarios de campos en venta o alquiler; y las operaciones rurales realizadas en el periodo analizado; entre otras variables.
El informe consigna que el pico de actividad de 2024 de mayo es consecuencia de la “continua caída de la inflación mensual y la consolidación de la macroeconomía”.
Agrega que “dada la expectativa de mejora en la economía, se incrementaron las consultas, revisaciones y ofertas”.
En cuanto a la diferencia entre lo pedido y lo ofertado, el informe de CAIR indica que “es cada día menor y la ausencia de oferta de campos agrícolas en zona núcleo consolida una mayor demanda en zonas más alejadas”.
Con respecto a los contratos de arrendamientos agrícolas, el análisis señala que “se han ido cerrando con valores similares al año pasado y con algunos incrementos puntuales y una demanda insatisfecha”.
Nuevo
",home
Lácteos sin retenciones hasta junio de 2025,https://www.infobae.com/revista-chacra/2024/06/29/lacteos-sin-retenciones-hasta-junio-de-2025/,"A partir del 1 de julio, entra en vigencia una nueva prórroga para la suspensión del cobro de retenciones a las exportaciones a los lácteos por un período de 12 meses. La medida, fue dispuesta por el Gobierno Nacional y anunciada por el Ministerio de Economía el pasado 8 de mayo.
Si se consideran los dos meses iniciales, dispuestos por la gestión de Alberto Fernández el 3 de octubre de 2023; sumados a los seis meses más establecidos en diciembre 2023 por un decreto presidencial de Javier Mieli, y los doce meses que regirán a partir del lunes 1°de julio de 2024, la exención impositiva para la exportación de lácteos suma veinte meses.
Previo a la suspensión de los derechos de exportación, los lácteos pagaban un 9% de retenciones en el caso de la leche en polvo, mientras que los quesos abonaban 4,5%.
Actualmente, la exportación se lleva alrededor del 20% de la producción total de leche de la Argentina, según un informe elaborado por el Observatorio de la Cadena Láctea (OCLA). En tanto que “poco más del 70% que se destina al mercado interno, que tiene un poder adquisitivo totalmente deteriorado por el proceso inflacionario, sobre todo de la clase media, principal demandante de lácteos de mayor valor agregado”.
En el estudio, publicado en abril pasado, la OCLA detalló que  “la cantidad de tambos en la Argentina se redujo el último año un 4,5%” Y agregó que: “en total, en el país habría 9.735 unidades productivas registradas, cuando un año antes eran 10.197″. Es decir que, por primera vez en al menos 40 años, la cantidad de tambos perforó la barrera de los 10.000 y la comparación la línea histórica muestra que son 5.000 menos que los que había a principios de siglo, y 20.000 menos que en 1998, cuando superaban los 30.000″. El informe subraya, además, que hay 1.486.248 vacas en ordeñe, el valor más bajo de una serie que se inicia en 2005.
En cuanto al consumo interno, informó que en el acumulado del primer trimestre de 2024 se produjo una caída del 18,7% en volumen de productos lácteos y del 15,2% en litros de leche equivalentes. Este volumen representa una baja del 16,1% en el promedio diario.
La OCLA detalló que “puede observarse, una caída muy importante en todos los rubros salvo quesos que cayó un 8,8% en litros equivalentes. Los productos de mayor valor agregado y unitario como quesos de pasta muy blanda, quesos rallados, leches saborizadas, yogures, flanes y postres presentaron una gran caída asociada a las subas de precios y al retraso en el poder adquisitivo del sector medio de la población que demanda en mayor cuantía estos productos”.
En ese marco, el Gobierno justificaba su decisión el pasado 8 de mayo, puntualizando que “la medida brinda previsibilidad y mayor competitividad a todos los eslabones de la cadena láctea y busca incentivar el desarrollo de inversiones orientadas al aumento de la producción de leche y a la mejora de los procesos, tanto a nivel de producción primaria como industrial”.
Asimismo, agregaba que “la decisión generará una mayor inserción de los productos lácteos nacionales en el mercado internacional con valor agregado e incrementará el ingreso de divisas a través de la exportación”, así como también “impactará fuertemente en el desarrollo de la economías de las regiones de las principales provincias productoras de leche”.
Nuevo
",home
