TITLE,BODY,URL,SECTION
"Viaje de madrugada y denuncia: la trama de la presentación de la Tía de Loan, que cambió el rumbo de la investigación",https://www.infobae.com/sociedad/policiales/2024/06/29/viaje-de-madrugada-y-denuncia-la-trama-de-la-presentacion-de-la-tia-de-loan-que-cambio-el-rumbo-de-la-investigacion/,"Laudelina Peña, la tía de Loan, llegó a la fiscalía de turno de la justicia ordinaria de la ciudad de Corrientes a la medianoche del viernes junto a su abogado José Codazzi, quien no participó de la toma de la denuncia. Lo hizo tras viajar desde la localidad de 9 de Julio, de donde es oriunda. Al arribar, la mujer dijo que quería hacer una declaración que estaba relacionada con la desaparición del niño de cinco años. Se trataba de un dato que, según adelantó, podría resolver el caso.
Lo que quería contar era que ella había sido testigo de cómo el capitán de navío (RE) Carlos Pérez y su mujer, María Victoria Caillava, habían atropellado al nene luego del almuerzo en la casa de Catalina, su abuela, donde lo vieron por última vez. “Está muerto”, aseguró en su denuncia.
La causa que investiga el paradero del menor está en la justicia federal. No obstante, Laudelina hizo su presentación ante la justicia de Corrientes. Y como es una obligación del fiscal tomar la presentación de todas formas, rápidamente la atendieron.
De acuerdo a los detalles a los que accedió Infobae, al llegar a la fiscalía la mujer contó que había viajado mucho, que sentía temor y se sentía hostigada, amenazada y condicionada por el ambiente en su lugar de residencia. Además, reveló sentirse presionada por “la sociedad, los juzgados y fiscalías de Goya y 9 de julio”, como justificación de por qué fue a hasta Corrientes.
Ante esta situación, el fiscal la entrevistó y filmó el procedimiento para que haya constancia de sus dichos en registros fílmicos. En la denuncia -que duró media hora y terminó en horas de la madrugada- Laudelina dijo que la funcionaria municipal, María Victoria Caillava, la había amenazado para que no dijera nada de lo que vio y dijo que fue ella quien le ordenó plantar la zapatilla del nene lejos de los rastrillajes. 
En ese contexto, también dio detalles del accidente del que fue testigo, en el que atropellaron al menor. Un hecho que desde la justicia fue considerado como un delito.
Según su descripción, este ocurrió en la localidad de 9 de julio, por lo que sus dichos fueron remitidos en el marco de la denuncia a la UFRAC de Goya, a cargo de Guillermo Barry, a quien se le entregó el video teniendo en cuenta de que hay circunstancias relevantes que pueden ser útiles y que también pueden servir para la justicia federal. 
Por este motivo es que se estableció una comunicación con la PROTEX, aunque no SE logró hacer lo mismo con el fiscal Mariano de Guzmán, a cargo de la fiscalía federal de Goya. Ahora depende de Barry y de la justicia federal cómo proceder.
Laudelina Peña no quedó detenida tras prestar declaración, aunque sus dichos provocaron un gran despliegue de la policía, que ahora buscan con un drone y rastrillajes el cuerpo de Loan en el basural de la ciudad correntina en la que desapareció. Se trata de la zona que ella marcó como posible lugar en el que podría estar el cuerpo, consignó NA.
Las declaraciones de la mujer fueron remitidas a la justicia federal que estaba llevando el caso, la cual deberá ratificar lo que dijo, interrogando nuevamente a la tía del menor -como testigo o ya como imputada- y además corroborar su versión con pruebas físicas. Luego tendrá que decidir en qué fuero sigue la causa: si, como dice la versión que hoy circula, se trató de un accidente, la causa debería volver al fuero provincial porque se trataría de un delito ordinario.
En caso de confirmarse la versión del atropello, un levantamiento de rastros al vehículo en cuestión podría dar una prueba del impacto que le quitó la vida a Loan: debería haber un rastro de sangre o cualquier tejido, o una marca detectable con tests de reactivo
Nuevo
",home
La declaración de la tía de Loan en detalle: cómo fue el accidente en el que habría muerto el niño y la amenaza para que no cuente nada,https://www.infobae.com/sociedad/policiales/2024/06/29/la-declaracion-de-la-tia-de-loan-en-detalle-como-fue-el-accidente-en-el-que-habria-muerto-el-nino-y-la-amenaza-para-que-no-cuente-nada/,"Laudelina Peña aseguró estar amenazada. Por eso, hasta el momento había decidido guardar silencio en el marco de la investigación por la desaparición de su sobrino Loan Danilo Peña, buscado desde hace más de 15 días en Corrientes. Fue su abogado, José Codazzi, quien este viernes actuó de intermediario entre ella y la Fiscalía General de la provincia para finalmente convencerla de que prestara su declaración para la causa, que ya tiene seis detenidos. Entre ellos su esposo, Antonio Bernardino Benítez, acusado de abandono de persona.
La declaración de la tía del niño comenzó a las tres de la mañana y se dio bajo un hermetismo total. La mujer asistió a la fiscalía de turno acompañada de su representante legal y contó, por primera vez, su versión de los hechos desarrollados el pasado jueves 13 de junio, cuando el menor de cinco años fue visto por última vez. Lo hizo ante el fiscal Gustavo Alejandro Robineau, titular de la UFI 6, a quien le confesó que Loan murió tras ser atropellado por el capitán de navío (RE) Carlos Pérez y su mujer, María Victoria Caillava.
Según confiaron fuentes de la investigación a Infobae, Laudelina declaró en media hora y finalizó el trámite al rededor de las 5 am. En este marco, contó que el accidente vial ocurrió cuando ella volvió del naranjal, al que había ido con varios otros de los invitados al almuerzo realizado ese mediodía en la casa de Catalina, la abuela del chico.
Fue apenas a unos metros de la vivienda que sintió un golpe y una frenada: Loan se había cruzado por delante del vehículo que conducía la pareja y resultó atropellado. Se habría tratado de un impacto de frente, de acuerdo a su descripción.
La tía del menor vio el episodio posterior de casualidad. Tras oír la secuencia, esta se acercó al lugar y descubrió al matrimonio subiendo al nene a la camioneta. Lo cargaron entre los dos en la parte trasera del vehículo, donde días más tarde la policía halló rastros de Loan y ordenó la detención de ambos.
Laudelina contó en su declaración que la pareja la engañó: le dijeron que ellos se iban a encargar de darle asistencia médica a la víctima, al tiempo que le iban a avisar de lo sucedido al comisario Walter Maciel, también aprehendido en la causa por encubrimiento. Asimismo, le pidieron que no dijera nada de lo que vio.
Tras cometer el choque, la pareja se retiró del lugar. Pero apenas un rato después volvió para amenazar de muerte a la tía de Loan. Victoria Caillava fue quien le dijo, en tonos violentos, que “se callara la boca” y no dijera nada de lo que presenció.
Bajo esta amenaza es que, de acuerdo a su relato, también le dieron una orden. Fue cuando ya había comenzado la búsqueda desesperada por el niño que ambos le pidieron a Laudelina que vaya a plantar la zapatilla de Loan en un camino alternativo con el fin de desviar el rastrillaje que realizaba la policía para otro lado. Ante el temor, ella cumplió y lo hizo.
Laudelina Peña no quedó detenida tras prestar declaración, aunque sus dichos provocaron un gran despliegue de la policía, que ahora buscan con un drone y rastrillajes el cuerpo de Loan en el basural de la ciudad correntina en la que desapareció. Se trata de la zona que ella marcó como posible lugar en el que podría estar el cuerpo, consignó NA.
Las declaraciones de la mujer fueron remitidas a la justicia federal que estaba llevando el caso, la cual deberá ratificar lo que dijo, interrogando nuevamente a la tía del menor -como testigo o ya como imputada- y además corroborar su versión con pruebas físicas. Luego tendrá que decidir en qué fuero sigue la causa: si, como dice la versión que hoy circula, se trató de un accidente, la causa debería volver al fuero provincial porque se trataría de un delito ordinario.
En caso de confirmarse la versión del atropello, un levantamiento de rastros al vehículo en cuestión podría dar una prueba del impacto que le quitó la vida a Loan: debería haber un rastro de sangre o cualquier tejido, o una marca detectable con tests de reactivos.
Nuevo
",home
"Con Garnacho desde el inicio y Di María como capitán, Argentina confirmó la formación para enfrentar a Perú",https://www.infobae.com/deportes/2024/06/29/una-argentina-alternativa-sin-messi-ni-scaloni-chocara-ante-una-urgida-peru-en-vivo-hora-tv-y-formaciones/,,home
Giro en la causa Loan: la tía confesó que el niño está muerto y que se habría tratado de un accidente,https://www.infobae.com/sociedad/2024/06/29/una-nueva-version-asegura-que-loan-murio-atropellado-y-que-hubo-un-encubrimiento/,"La desaparición de Loan Danilo Peña en Corrientes dio un giro inesperado este sábado: fuentes de la investigación confirmaron a Infobae que Laudelina Peña, tía del nene, confesó que el capitán de navío (RE) Carlos Pérez y su pareja habrían atropellado a Loan y que el niño está muerto. La mujer, que habría ayudado a encubrir el hecho, dio su declaración durante la noche del viernes ante el fiscal Gustavo Alejandro Robineau, pero no quedó detenida, según informaron a este medio.
Sus dichos ahora fueron remitidos a la justicia federal que estaba llevando el caso, la cual deberá ratificar lo que dijo, interrogando nuevamente a la tía del menor -como testigo o ya como imputada- y además corroborar su versión con pruebas físicas. Luego tendrá que decidir en qué fuero sigue la causa: si, como dice la versión que hoy circula, se trató de un accidente, la causa debería volver al fuero provincial porque se trataría de un delito ordinario.
En caso de confirmarse la versión del atropello, un levantamiento de rastros al vehículo en cuestión podría dar una prueba del impacto que le quitó la vida a Loan: debería haber un rastro de sangre o cualquier tejido, o una marca detectable con tests de reactivos.
En la lista de más de 50 pruebas que envió el Ministerio Público Fiscal de Corrientes a la Justicia federal, no consta un análisis forense de los autos de Carlos Pérez y su mujer, solo un rastreo de perros que indicó que Loan estuvo ahí. En este sentido, fuentes de la Justicia federal aseguraron a Infobae que existió un levantamiento de rastros entre las pruebas, pero no especificaron si se hicieron en los autos de la pareja imputada.
Este mediodía el mandatario provincial, Gustavo Valdés, adelantó en su cuenta de X que se había dado un paso importante en la resolución del caso Loan y, en una segunda publicación, se refirió a la declaración brindada por la tía de Loan en las últimas horas. “Laudelina declaró tanto ante la Fiscalía General como ante la Fiscalía Provincial de Corrientes, y habría narrado cómo fueron los hechos del Caso Loan. Todo lo actuado está remitiéndose ante la Justicia Federal para que proceda conforme a derecho”, posteó el gobernador sin dar más precisiones al respecto.
Este viernes quien había comprometido a Laudelina en el marco de la causa había sido su propio hermano, José Peña, el padre del niño desaparecido. Fue durante su declaración indagatoria que este apuntó directamente contra la tía del menor y esposa de Bernardino Antonio Benítez, otro de los detenidos del caso.
“Cuando todos van al naranjal, quien se lleva a Loan para allá es Laudelina. Yo lo vi. Y los seguí con la mirada hasta que los perdí de vista”, dijo el hombre. Tras esto, reafirmó sus dichos: “Yo nunca la perdí de vista a Laudelina y Loan se fue con ella”.
José explicó después un dato sumamente curioso: “Al rato vuelve Laudelina y me pregunta por Loan. Yo le dije que se había ido con ella. Pero ella me dice que no, que Loan estaba conmigo. Pero yo vi que se fue con ella”.
La hipótesis del accidente sorprende por el desarrollo de los hechos en la causa del fuero de instrucción correntino. Un accidente implica una acusación de homicidio culposo, un delito excarcelable. Pérez se negó a declarar en su indagatoria, tal como su pareja y el comisario Walter Maciel. ¿Por qué sus defensas permitieron que la situación escalara hacia una acusación posiblemente más grave como la trata de personas o un asesinato? Si Loan murió por un accidente y nada más, ¿por qué no lo confesaron desde el comienzo?
¿Por qué, incluso, el comisario del pueblo encubrió un delito que, a priori, no hubiese implicado una prisión preventiva? Hoy, los tres imputados, así como el marido de Laudelina, Antonio Benítez, se encuentran encerrados en cárceles federales.
De cara al hermetismo de los acusados, los fiscales Mariano de Guzmán y Alejandra Mangano habían planteado en su requerimiento para comenzar la instrucción la idea de un hecho de “criminalidad organizada”. Conversaciones extraoficiales de otros investigadores apuntaban a lo que se comentó a lo largo de la última semana: un caso de adopción ilegal, esclavitud sexual o laboral. Nunca se habló de un accidente.
Ayer por la tarde, los responsables de resolver el caso esperaban el comienzo de las pericias a los 20 celulares incautados a los imputados y a Laudelina Peña que iban a realizarse en el laboratorio de la División Pericias Telefónicas, ubicados en el histórico edificio de la PFA en Azopardo y México. Las pericias -de cuyo comienzo no se informó oficialmente- suponían la chance de un quiebre en la investigación ante el silencio de los acusados. Hoy, el quiebre de Laudelina cambia todo. En todo caso, se deberá corroborar su testimonio con pruebas forenses.
Tras analizar la denuncia de Laudelina, que no fue imputada aún en la causa federal, los fiscales Guzmán y Mangano tomarán las medidas pertinentes para determinar sus dichos. La hipótesis de que Loan murió en un accidente y luego encubierto, por ahora, no le cierra a la Justicia federal.
Ahora, la duda que recorre a ciertos investigadores es si la camioneta de Carlos Pérez fue opimamente preservada por la Policía de Corrientes para enfrentar una pericia exhaustiva que permita confirmar o descartar la denuncia de Laudelina.
Si la camioneta fue mal preservada, o no peritada a tiempo, la prueba que definiría o no si a Loan lo mataron podría haberse perdido.
Nuevo
",home
La búsqueda de Loan: por qué la declaración que cambió el rumbo de la causa se realizó en la Justicia de Corrientes y no ante el fiscal federal,https://www.infobae.com/sociedad/policiales/2024/06/29/la-busqueda-de-loan-por-que-la-declaracion-que-cambio-el-rumbo-de-la-causa-se-realizo-en-la-justicia-de-corrientes-y-no-ante-el-fiscal-federal/,"En las últimas horas, Laudelina Peña, la tía de Loan, dio una declaración clave que cambió el rumbo de la causa que investiga el paradero del menor desaparecido hace más de 15 días en la provincia de Corrientes: confesó que el niño está muerto y que habría sido atropellado por el capitán de navío (RE) Carlos Pérez y su pareja, Victoria Caillava. Sin embargo, su denuncia la realizó en la Justicia de Corrientes y no ante el fiscal federal, que lleva adelante el caso.
La explicación a esta particularidad tiene que ver con el contexto en el que la mujer accedió a hablar. Según su entorno, fue necesario recrear en un ambiente de extrema confianza para que, acompañada de su abogado José Codazzi, expresara lo que tenía para decir. 
La mujer llegó en un auto gris a Corrientes para presentarse ante la fiscalía en turno de la provincia y contar su versión de lo ocurrido el día 13 de junio, cuando el menor fue visto por última vez durante un almuerzo en la casa de su abuela Catalina.
Según explicaron indicaron fuentes del caso, la dependencia fiscal a la que asistió tiene la obligación de recibir la denuncia y no se puede negar a hacerlo más allá de que el caso tenga una causa abierta en la justicia federal. Por este motivo, Laudelina fue atendida por Gustavo Robineau, titular de la UFI 6, quien estaba de turno, período en el que también tiene a su cargo de la Unidad Fiscal de Recepción y análisis de casos.
De esta forma, durante la madrugada, se inició el trámite en el que la tía de Loan comenzó a dar su declaración. Lo hizo a las tres de la mañana, se demoró media hora y finalizó cerca de las 5 am. Durante ese tiempo, la mujer relató lo que vio y detalló en qué momentos tomó participación del episodio. Al terminar, se retiró junto a su representante legal. No quedó detenida más allá de haber admitido que encubrió el incidente y que ayudó a plantar una pista falsa para desviar los rastrillajes.
Los dichos de Laudelina ahora fueron remitidos a la justicia federal que estaba llevando el caso, la cual deberá ratificar lo que dijo, interrogando nuevamente a la tía del menor -como testigo o ya como imputada- y además corroborar su versión con pruebas físicas. Luego tendrá que decidir en qué fuero sigue la causa: si, como dice la versión que hoy circula, se trató de un accidente, la causa debería volver al fuero provincial porque se trataría de un delito ordinario.
En caso de confirmarse la versión del atropello, un levantamiento de rastros al vehículo en cuestión podría dar una prueba del impacto que le quitó la vida a Loan: debería haber un rastro de sangre o cualquier tejido, o una marca detectable con tests de reactivos.
En la lista de más de 50 pruebas que envió el Ministerio Público Fiscal de Corrientes a la Justicia federal, no consta un análisis forense de los autos de Carlos Pérez y su mujer, solo un rastreo de perros que indicó que Loan estuvo ahí. En este sentido, fuentes de la Justicia federal aseguraron a Infobae que existió un levantamiento de rastros entre las pruebas, pero no especificaron si se hicieron en los autos de la pareja imputada.
Este mediodía el mandatario provincial, Gustavo Valdés, adelantó en su cuenta de X que se había dado un paso importante en la resolución del caso Loan y, en una segunda publicación, se refirió a la declaración brindada por la tía de Loan en las últimas horas. “Laudelina declaró tanto ante la Fiscalía General como ante la Fiscalía Provincial de Corrientes, y habría narrado cómo fueron los hechos del Caso Loan. Todo lo actuado está remitiéndose ante la Justicia Federal para que proceda conforme a derecho”, posteó el gobernador sin dar más precisiones al respecto.
Nuevo
",home
"La búsqueda de Loan, en vivo: tras la revelación de la tía de Loan, el militar retirado y la funcionaria estarían dispuestos a declarar para desmentir la versión",https://www.infobae.com/sociedad/policiales/2024/06/29/la-busqueda-de-loan-en-vivo-las-ultimas-noticias-sobre-su-desaparicion-en-corrientes/,,home
Video: buscan el cuerpo de Loan con drones especiales en un basural tras la confesión de la tía,https://www.infobae.com/sociedad/policiales/2024/06/29/buscan-el-cuerpo-de-loan-con-drones-especiales-en-un-basural-tras-la-confesion-de-la-tia/,"Poco después del mediodía de hoy, una misión de la Policía Bonaerense que llegó a la zona de 9 de Julio en Corrientes citada por la Justicia comenzó junto a la Policía Federal la búsqueda del cuerpo de Loan Danilo Peña, al que se presume muerto tras la denuncia y confesión de su tía Laudelina, que aseguró que Carlos Pérez, el principal imputado del caso, lo atropelló supuestamente ebrio y luego escondió el cadáver, para silenciarla bajo amenazas de muerte.
La búsqueda, realizada por aire con drones, se concentra ahora en dos puntos: un basural de la zona de 9 de Julio y el campo de la abuela del niño, Catalina Peña, en donde almorzó con sus presuntos victimarios 16 días atrás. “Nos tuvieron parados todo el día hasta que salió la aprobación judicial para investigar en torno a esta declaración”, asegura una fuente que participa de la búsqueda. El basural queda a un kilómetro y medio de la casa del matrimonio del capitán de navío retirado Carlos Pérez y María Victoria Caillava y de la propiedad del comisario Walter Maciel, los tres principales detenidos por el caso. 
En su declaración, Laudelina no aportó la ubicación del cuerpo de Loan. “Hay una teoría de que el cadáver podría estar aquí”, asegura la misma fuente. La zona no fue rastrillada previamente, aseguran investigadores.
Los rastrillajes para ubicar a Loan, vivo o muerto, cubrieron ya más de 12 mil hectáreas, con buzos tácticos, drones diurnos y de visión nocturna, perros de la Policía Federal, del Servicio Penitenciario Bonaerense y de la Policía de Corrientes, sin resultados hasta ahora. También se realizaron tareas en Chaco y en un camping de la zona bonaerense de Zárate. La Justicia cordobesa investigó una denuncia de una mujer residente en la capital provincial que manifestó que el día 26 de junio de 2024,  alrededor de las 17 horas, vio a un niño de la edad y con las características físicas similares a las de Loan en la puerta del dispensario del barrio Obispo Angelelli.
Hasta fines de la semana pasada, según el Ministerio de Seguridad de la Nación, se habían hecho más de 400 denuncias a la línea 134 por el paradero del chico, todas ellas falsas alarmas.
Según confirmaron las mismas fuentes, el Ministerio de Seguridad de la provincia de Buenos Aires aportó cuatro equipos de drones JOUAV modelos CW100 y CW15, de alto alcance, que pertenecen a la Sección Táctica de Video Vigilancia, de la Superintendencia de Comunicaciones. Cuentan con cámara termográfica, lente gran angular, zoom de 30x, telémetro láser de seguimiento, autonomía de vuelo de diez horas y un rango de operación de cien kilómetros de radio. “Es, básicamente, un mini avión no tripulado”, asegura una fuente oficial. Otros drones de menor porte, como los DJI Matrice RTK300, también son parte de la misión.
La Justicia federal, con los fiscales Mariano de Guzmán y Alejandra Mangano, mira con recelo la confesión de Laudelina, no les cierra. La hipótesis del accidente sorprende por el desarrollo de los hechos en la causa del fuero de instrucción correntino. Un accidente implica una acusación de homicidio culposo, un delito excarcelable. Pérez se negó a declarar en su indagatoria, tal como su pareja y el comisario Walter Maciel. ¿Por qué sus defensas permitieron que la situación escalara hacia una acusación posiblemente más grave como la trata de personas o un asesinato? Si Loan murió por un accidente y nada más, ¿por qué no lo confesaron desde el comienzo?
Tras analizar la denuncia de Laudelina, que no fue imputada aún en la causa federal, los fiscales Guzmán y Mangano tomarán las medidas pertinentes para determinar sus dichos. La hipótesis de que Loan murió en un accidente y luego encubierto, por ahora, no le cierra a la Justicia federal.
No solo se trata del cuerpo de Loan, sino también de la camioneta con la que fue atropellado. La duda que recorre a ciertos investigadores es si el vehículo de Carlos Pérez fue óptimamente preservada por la Policía de Corrientes para enfrentar una pericia exhaustiva que permita confirmar o descartar la denuncia de Laudelina.
Si la camioneta fue mal preservada, o no peritada a tiempo, la prueba que definiría o no si a Loan lo mataron, ante la posible ausencia de un cuerpo, podría haberse perdido.
Nuevo
",home
