TITLE,BODY,URL,SECTION
¿Por qué en invierno es fundamental el consumo de hierro y vitamina B12 para la salud?,https://www.infobae.com/salud/2024/06/29/por-que-en-invierno-es-fundamental-el-consumo-de-hierro-y-vitamina-b12-para-la-salud/,"El hierro es un mineral necesario para el crecimiento y desarrollo del cuerpo humano. También se requiere de la vitamina B12 que contribuye a muchas funciones corporales esenciales. Como esa vitamina se encuentra de forma natural en muchos productos de origen animal, se puede incorporar fácilmente con la alimentación diaria.
Con la llegada del invierno, no solo importa el abrigo de las ropas y la calefacción. También el cuerpo experimenta cambios en los niveles de energía, el metabolismo e incluso en las preferencias alimentarias.
“Durante el tiempo con temperaturas más bajas, es recomendable tener en cuenta qué tipo de comidas se consumen y considerar cuáles favorecen la ingesta de hierro, vitamina B12 y zinc”, afirmó César Casávola, jefe del servicio de nutrición del Hospital Alemán de Buenos Aires, Argentina, en diálogo con Infobae.
“Por ejemplo, para ingerir hierro, se pueden consumir carnes rojas en guisos. Algunas verduras, como la espinaca, también tienen hierro -señaló el experto-. Pero contiene muchos oxalatos, fitatos y taninos que son inhibidores de la absorción del hierro por el sistema digestivo”.
Esos inhibidores se encuentran también en el salvado de trigo y en la cáscara de los cereales, en el té y en el café. “Si se consume carne, se debería tomar té o café recién cuando ya se hizo la digestión y no inmediatamente. Esto hará que el hierro de la carne sí sea bien absorbido”, aclaró.
“Preparar la dieta para el invierno puede ser saludable -y sabroso- si se añaden algunos de los alimentos favoritos para el frío”, afirmó la especialista en nutrición de la Clínica Cleveland de los Estados Unidos, Beth Czerwony.
Ningún clima justifica hábitos alimentarios poco saludables. Del mismo modo que no se debe abusar del helado durante los días más calurosos del verano, tampoco se debe vivir a base de chocolate caliente y galletas durante el invierno. En ese contexto, cuidar los niveles de ingesta de hierro y vitamina B12 es clave para la salud.
El cuerpo utiliza el hierro para fabricar la hemoglobina, una proteína de los glóbulos rojos que transporta el oxígeno de los pulmones a distintas partes del cuerpo, además de la mioglobina, una proteína que suministra oxígeno a los músculos, según la Oficina de Suplementos Dietarios de los Institutos Nacionales de Salud (NIH, por sus siglas en inglés) de los Estados Unidos.
El cuerpo también necesita hierro para fabricar las hormonas y el tejido conectivo.
La cantidad diaria de hierro que una persona necesita varía según la edad y el sexo; dependerá también de si su alimentación consiste principalmente en productos de origen vegetal. A continuación, se indican las cantidades diarias promedio de hierro recomendadas en miligramos (mg): de acuerdo con las normativas de los NIH, se aconseja que los hombres de todas las edades y las mujeres mayores de 50 años consuman al menos 8 miligramos de hierro diarios.
Las mujeres de entre 19 y 50 años deberían ingerir 18 miligramos por día y durante el embarazo, la cantidad recomendada se eleva a 27 miligramos.
Los vegetarianos que no consumen carne, aves ni mariscos necesitan casi el doble de las cantidades de hierro indicadas a continuación, porque el cuerpo absorbe mejor el hierro “hemo” de origen animal que el hierro “no hemo” de los vegetales y alimentos fortificados con hierro.
A corto plazo, el consumo insuficiente de hierro no causa síntomas evidentes. El cuerpo utiliza el hierro almacenado en los músculos, el hígado, el bazo y la médula ósea.
Pero cuando los niveles de hierro almacenados en el cuerpo disminuyen, se produce la anemia por deficiencia de hierro. Los glóbulos rojos disminuyen de tamaño y contienen menos hemoglobina. Como resultado, la sangre transporta menos oxígeno desde los pulmones hasta el resto del cuerpo.
Los síntomas de anemia por deficiencia de hierro (conocida como “anemia ferropénica”) incluyen el cansancio y la falta de energía, trastornos intestinales, falta de memoria y concentración, además de disminución de la habilidad para combatir los microbios y las infecciones o de controlar la temperatura del cuerpo. Los bebés y los niños con anemia ferropénica pueden desarrollar dificultades de aprendizaje.
La deficiencia de hierro puede ocurrir en personas que no comen carnes, aves o mariscos; en quienes sufren pérdida de sangre, trastornos intestinales que interfieren con la absorción de los nutrientes o en quienes no se alimentan de manera saludable.
El hierro se encuentra naturalmente presente en los alimentos y en ciertos alimentos fortificados con hierro. Entre los que más contienen se encuentran:
Para mejorar la absorción del hierro de los alimentos de origen vegetal, se deben acompañar con carnes, aves, mariscos y alimentos con vitamina C (como cítricos, fresas, pimientos dulces, tomates y brócoli).
La vitamina B12 es un nutriente que ayuda a mantener la salud de las neuronas y la sangre. Además, contribuye a la formación del ácido desoxirribonucleico (ADN), el material genético presente en todas las células. Asimismo, ayuda a prevenir la anemia megaloblástica, un trastorno de la sangre que causa cansancio y debilidad.
El cuerpo almacena entre 1.000 y 2.000 veces la cantidad de vitamina B12 que se suele ingerir en un día. Por ese motivo, los síntomas de deficiencia de vitamina B12 pueden tardar varios años en manifestarse.
Si una persona tiene deficiencia de vitamina B12, es posible que se sienta cansada o débil. Pueden ser síntomas de la anemia megaloblástica, que es característica de la deficiencia de vitamina B12.
Además, es posible que la persona tenga la piel pálida, palpitaciones, pérdida del apetito, pérdida de peso e infertilidad. Las manos y los pies podrían presentar adormecimiento u hormigueo, lo cual es un signo de problemas de los nervios.
Otros síntomas de la deficiencia de vitamina B12 son problemas de equilibrio, depresión, confusión, demencia, mala memoria y ulceraciones en la boca o la lengua.
En los bebés, los signos de una deficiencia de vitamina B12 incluyen retraso en el crecimiento, demoras en alcanzar los logros característicos del desarrollo y anemia megaloblástica.
La deficiencia de vitamina B12 puede causar daños en el sistema nervioso, incluso en personas que no tienen anemia megaloblástica. Por eso, es importante tratar cualquier deficiencia lo antes posible.
La vitamina B12 está presente en muchos alimentos de origen animal. Los alimentos de origen vegetal no contienen vitamina B12 excepto si son fortificados. Para consumir las cantidades recomendadas de vitamina B12, hay que comer alimentos variados como:
Nuevo
",home
“Esperamos a Di María para después de la Copa América”: la bomba del presidente de un importante club de Europa,https://www.infobae.com/deportes/2024/06/29/esperamos-a-di-maria-para-despues-de-la-copa-america-la-bomba-del-presidente-de-un-importante-club-de-europa/,"Una bomba explotó en las últimas horas en Europa y la onda expansiva llegó hasta Argentina. El Besiktas mostró un firme interés en Ángel Di María, una noticia que fue confirmada por el presidente del club, Huseyin Yucel. Según sus palabras, las negociaciones están en marcha, y el resultado dependerá de la respuesta del jugador tras la Copa América.
“Estamos esperando a Di María para después de la Copa América porque hemos hecho todo lo posible. Ha dicho que decidirá después de la Copa América”, mencionó el mandatario en declaraciones a la televisión turca.
Vale destacar que el futuro del Fideo aún está por definirse luego de quedar con el pase en su poder. Actualmente, participa en la Copa América con la selección argentina y se espera que tome una decisión después del torneo. Di María será jugador libre al finalizar su contrato con el Benfica el 30 de junio, pero el club portugués le ha ofrecido continuar, debido a su desempeño destacado durante la temporada, donde anotó 17 goles y brindó 15 asistencias.
Otros equipos también están interesados en el jugador. Rosario Central sigue esperando su regreso, aunque las amenazas de bandas narcos han complicado este deseo. También sonó para el Inter Miami, aunque el propio Gerardo Martino fue el encargado de mermar estas versiones: “Sobre Di María me mencionaron una posibilidad muy al pasar. Yo hoy en día no me imagino...”. Y luego, añadió: “Los lugares en los que imagino yo que vendría Ángel, están ocupados. No tenemos lugar en los ‘Designated Player’ (Jugador franquicia) y no lo veo por ese lado... Pero después las negociaciones pueden hacerse y aparece un jugador que uno dice: ‘Che, ¿pero no era que no tenia lugar como DP?’”. Mientras tanto, el Besiktas intenta atraer al argentino con la promesa de participar en la Europa League durante la temporada 24/25.
El presidente del Besiktas, Yucel, reiteró durante la entrevista que el club ha hecho todo lo posible para asegurar la firma del campeón del mundo en Qatar 2022. “Si viene, vendrá gratis por un solo año”, aseguró. Además, explicó que la decisión también dependerá de la valoración económica que haga el jugador y de la adaptación de su familia para vivir en Estambul. “Ya tenemos expectativas. Sí, sí. Yo también tengo muchas expectativas, pero está bien. Es bueno ir con calma de nuevo”, añadió.
El entrenador del Besiktas, el neerlandés Giovanni van Bronckhorst, también está en espera de la decisión final del jugador. Recientemente, el club turco incorporó al delantero portugués Rafa Silva, quien quedó libre del Benfica.
Por otra parte, Di María se ha mantenido enfocado en la Copa América, y ha dejado claro que su decisión la comunicará después del torneo, que será el último en el que defenderá la camiseta de la selección argentina, con la que ya ganó la medalla de oro en los Juegos Olímpicos de Beijing 2008, el Mundial Sub 20 de Canadá, la Copa América 2021, la Finalissima 2022 contra Italia y el Mundial de Qatar 2022. Además, fue subcampeón en la Copa del Mundo de Brasil 2014.   El rosarino, de 36 años, sería de la partida en el compromiso de esta noche ante Perú y podría ser el portador del brazalete de capitán ante la ausencia de su amigo Lionel Messi, quien descansará producto de una molestia muscular. El zurdo fue de la partida en la victoria 2-0 contra Canadá e ingresó en el complemento en el triunfo 1-0 ante Chile. 
Nuevo
",home
"A 20 años del amistoso express en el que Messi debutó en la Selección: el blooper en la citación, la orden que no acató y el irrisorio valor de la entrada",https://www.infobae.com/deportes/2024/06/29/a-20-anos-del-amistoso-express-en-el-que-messi-debuto-en-la-seleccion-el-blooper-en-la-citacion-la-orden-que-no-acato-y-el-irrisorio-valor-de-la-entrada/,"El 29 de junio de 2004, exactamente hace 20 años, entre 200 y 500 personas, según las estimaciones periodísticas, se sentaron en los escalones del estadio de Argentinos Juniors para ser testigos de la historia. Las entradas populares costaban apenas cinco pesos; las plateas, 10. Son curiosos datos recopilados por el libro Messi, el genio completo de Ariel Senosiain. “Claramente todos los que asistimos esa noche sabíamos que iba a ocurrir un acontecimiento especial”, aportó Diego Santonovich, periodista presente en aquel recinto en el que la magia matizaba el viento gélido.
En aquella jornada especial, un Lionel Messi de 17 años firmó con sus botines su compromiso eterno con la selección argentina. En un amistoso-excusa ante el combinado Sub 22 de Paraguay, la Albiceleste se impuso por 8 a 0 y la Pulga quedó “blindada” ante los embates de España para quedarse con su talento.
El rosarino saltó al campo con el dorsal N° 17, anotó el 7-0 y asistió a Pablo Vitti y a Federico Almerares en otras dos conquistas. Antes y durante aquel encuentro iniciático, el punto de partida de un idilio que halló su pico en la Copa América (y que pretende elevar la cumbre en Qatar 2022), arreciaron las peculiaridades, pequeñas historias que construyen lo que ya es una leyenda, que hoy busca repetir la gloria en la Copa América de Estados Unidos.
Mucho se habló del video del crack en ciernes que recibió Claudio Vivas, ayudante de campo de Marcelo Bielsa, quien al ver la cinta le solicitó, incrédulo, a su colaborador: “Ponelo en velocidad normal”. También de las señales que obtuvo Hugo Tocalli en el Mundial Sub 17 de Finlandia, donde hasta el cocinero de España le espetó: “Oye, Tocalli, si tú tenías a ese chaval del Barsa eras campeón”. O del diálogo entre el propio ex arquero y Julio Grondona para pergeñar los amistosos ante Paraguay y Uruguay en pos de espantar los fantasmas que azuzaban desde Europa. Pero la perla fue el método, artesanal, sublime, que utilizó Omar Souto, Gerente de Selecciones Nacionales, para dar con el prodigio y comunicarle la buena nueva de la citación.
“Me fui del predio de Ezeiza a un locutorio en Monte Grande. Pedí una guía telefónica de Rosario, sólo sabíamos que era rosarino. Arranqué la página donde estaban los números de los Messi, hice una llamada cualquiera a mi casa para justificar que había entrado y volví al predio para rastrearlo. A la primera cercana que ubiqué fue a la abuela. La abuela de Lionel me pasó el contacto del tío. El tío, el del padre. Llamé al padre, me presenté y le dije que queríamos contar con su hijo, con el detalle de que le erré al nombre: siempre había escuchado que Leo es el apodo de los Leonardo”, narró Souto en la imperdible obra de Senosiain.
Ya en su desembarco en el complejo de Ezeiza, el joven talento se topó con los valores y las reglas que transmitían Pekerman y su equipo. “¿Cómo no me voy a acordar de ese primer día? Llegó acompañado por el padre y el representante. Salió el preparador físico, que era (Gerardo) Salorio y le dijo: ‘Si no te cortás el pelo, no podés jugar’. Decí que no le hizo caso, ja. Tenía unas ganas de jugar para Argentina… Hablando con los dirigentes de España en Mundiales, se acercaban y nos decían: ‘Lo tentamos de todas las formas posibles, y nunca quiso aceptar jugar para nosotros’, le aportó Souto a Infobae.
Los compañeros lo conocían más por nombre o referencias que por imágenes. En el 2004 no habían explotado las redes sociales. Si hasta Bielsa debió apelar a un VHS para profundizar en su velocidad supersónica. No hizo falta socializar demasiado para que las jóvenes promesas que lo rodeaban comprobaran la verosimilitud del diamante en bruto del que tanto hablaban. “Cuando lo vimos jugar nos miramos entre todos. Agarró la pelota y aceleró de 0 a 100 como si nada”, se sorprendió Pablo Barrientos, entonces figura de San Lorenzo, que en el mentado partido de blindaje marcó dos goles y terminó dejando su lugar para abrirle de par en par la puerta albiceleste a la gema oculta en Barcelona.
“Nunca lo digo, pero lo tengo en mi memoria. Son esas cosas que me guardo para mí, no las comento mucho. Si lo dice otro me hago el tonto, digo, ‘capaz que sí, que fue así', ja”, se divirtió el Pitu, que participó del Sudamericano Sub 20 de 2005 junto a la Pulga.
Ezequiel Lavezzi, Ezequiel Garay, Federico Almerares (dos), Pablo Vitti y Messi cerraron el abultado score. “El partido fue una excusa, Argentina goleó, no tuvo oposición, y cada pelota que tocó Messi provocó que todos los ojos lo miraran. Cada movimiento suyo era observado con atención y ya en ese momento empezó a mostrar cosas de las que luego vendrían tanto con la Selección juvenil como con la Mayor”, describió Santonovich, que cubrió el partido para Olé y hoy se desempeña como Coordinador de Social Media en la Liga Profesional de Fútbol de la AFA.
“Después del partido, los pocos periodistas que habíamos ido a la cancha fuimos a buscar la palabra de Leo, que muy tímido aceptó hablar con la prensa, y muy cordialmente le dedicó minutos no sólo a una conferencia de prensa improvisada en el hall central de la cancha de Argentinos, sino que también habló con todo el que lo requiriera en particular, siempre acompañado por su padre Jorge. Recuerdo que él manejaba la situación del contacto con los medios y hasta pasaba su teléfono como puente para mediar entre la prensa y Leo”, describió una escena hoy inverosímil, pero hasta lógica en tiempos de descubrimiento.
“Fue una jornada particular, con cierta emotividad, sabiendo que se estaba gestando algo, pero lo que vino después terminó marcando que lo que esperábamos fue mucho más. Terminamos siendo testigos del debut del mejor jugador de todos los tiempos con la camiseta de Argentina y eso queda guardado por siempre”, puso en valor Santonovich.
Algunos no sólo atesoran el recuerdo. Pablo Alvarado, defensor ex Ciclón, también puede ufanarse de haberse quedado con algo que pertenecía al astro: “Habíamos jugado el primer partido con Paraguay, cuando debutó Messi en la Selección, y después viajamos a Uruguay. Había una plata de viáticos, y justo el que me la da me dice ‘no tengo dos billetes de 50 dólares, te doy 100 y 50 son para Leo’. Me acerqué a él y le dije: ‘No tengo 50 para darte, ¿vos tenés?’ ‘No, no, tranquilo, después me los das’, me respondió. Pasó el tiempo y no lo volví a ver. Así de simple. Es mi anécdota con Messi, porque después no tuve la suerte de jugar más con él, por lo menos me quedó esa anécdota”. Una cifra menor en comparación con el precio de la historia.
Nuevo
",home
