TITLE,BODY,URL,SECTION
Más de la mitad del país está bajo alerta por frío extremo y cayó nieve en algunos puntos de Buenos Aires,https://www.infobae.com/sociedad/2024/06/29/mas-de-la-mitad-del-pais-esta-bajo-alerta-por-frio-extremo-y-cayo-nieve-en-algunos-puntos-de-buenos-aires/,"Para el último fin de semana de junio, el Servicio Meteorológico Nacional (SMN) anunció una fuerte baja en la temperatura en varias zonas del país. Ante este panorama, en un total de 19 provincias regirán alertas por frío extremo durante la jornada del sábado. Incluso, se registraron las primeras precipitaciones de nieve en algunos puntos de la provincia de Buenos Aires, como Mar del Plata y alrededores.
De acuerdo con las alertas emitidas por el organismo meteorológico, las provincias que serán afectadas son Buenos Aires, Córdoba, Santa Fe, La Pampa, Entre Ríos, Corrientes, Santiago del Estero, Salta, Jujuy, Catamarca, La Rioja, Tucumán, San Juan, San Luis, Mendoza, Neuquén, Chubut, Santa Cruz y Tierra del Fuego.
En la mayor parte de las regiones alcanzadas por la ola polar se mantendrá activa la alerta amarilla que indicaría la posibilidad de que el frío tenga un efecto leve a moderado en la salud, sobre todo, en los niños, personas mayores de 65 años y pacientes con enfermedades crónicas. Sin embargo, el oeste santacruceño estará bajo alerta roja, por lo que remarcaron que toda la población podría estar en peligro.
La emisión de la alerta roja no deja de preocupar a las autoridades provinciales y nacionales, debido a que en las últimas semanas la región de la Patagonia fue azotada por nevadas y bajas temperaturas que incentivaron al gobernador Claudio Vidal a presentar un decreto en la Cámara de Diputados de Santa Cruz para declarar el Estado de Emergencia Climática.
Según la información obtenida por Patagonia24, en el proyecto remarcaron que la medida sería de carácter excepcional, ya que las condiciones climáticas provocaron que haya regiones desconectadas por la imposibilidad de transitar en algunas rutas provinciales. Además de señalar las consecuencias que ocasionaron en la cotidianeidad de los ciudadanos, plantearon la posibilidad de que las condiciones climáticas repercutan en la administración de los recursos primordiales del área.
En los últimos días, la Ruta 3 sufrió varios cortes en diferentes tramos producto de la acumulación de nieve, lo que provocó que los camiones que transportan alimentos y medicamentos no pudieran ingresar a Tierra del Fuego. Uno de los cortes detectados ocurrió en Comodoro Rivadavia, en donde se retrasó la limpieza del camino por la falta de maquinarias.
En paralelo, en las localidades santacruceñas de Tres Cerros y San Julián también se reportaron problemas con voladeros, un fenómeno climático conocido como un fuerte viento que afecta a la visibilidad de la ruta. Según El diario del fin del mundo, esto provocaría que los conductores perdieran el sentido de la orientación, por lo que se cortó el tránsito como medidas de precaución.
Por otro lado, en línea con lo informado por Radio 3, el Gobierno de Chubut decretó la Emergencia Climática y Agroganadera luego de que señalaran que, al menos, un 50% del ganado ovino de la provincia podría morir producto de los fríos extremos. Previo a esto, la Federación Rural chubutense presentó un reclamo en el que indicaban que la acumulación de nieve imposibilitaba la alimentación de los animales y su traslado hacia otras áreas.
“Vamos a establecer una partida extraordinaria, en el corto plazo se va a ejecutar a través del Ministerio de Producción”, explicó el mandatario Ignacio Torres al remarcar que “es muy importante para la Patagonia” brindar asistencia y proteger a la producción agropecuaria.
En la provincia de Buenos Aires, durante las primeras horas de la madrugada se reportaron nevadas en varias localidades cercanas a la costa bonaerense, entre ellas, Sierra de los Padres y Batán. Además, según el testimonio de varios de los habitantes, se vieron caer una suerte de copos de nieve en los alrededores de Mar del Plata.
Horas antes, el servicio meteorológico había extendido la alerta por nevadas, debido a que se espera que el fenómeno meteorológico se desarrolle durante la madrugada del sábado. La condición mutaría a chaparrones y permanecería en ese estado el resto del día, mientras que el termómetro oscilará entre una mínima de 5 grados y una máxima de 8 grados.
Para hoy, el SMN prevé una temperatura mínima de 2 grados y una máxima de 10. Con un cielo ligera y parcialmente nublado por la tarde y la noche, respectivamente, la probabilidad de precipitaciones se mantiene nula en Ciudad de Buenos Aires y el conurbano bonaerense. 
Ya el domingo, la temperatura máxima alcanzará los 14 grados, en tanto, la mínima se mantendrá igual. Sin probabilidad de caída de lluvia en la zona, se espera una jornada nublada desde la mañana hasta la noche. 
Las autoridades del SMN remarcaron que las bajas temperaturas podrían provocar complicaciones en la salud de los habitantes, por lo que emitieron una serie de recomendaciones para evitar ponerse en riesgo. Asimismo, remarcaron la importancia de acudir al médico, si se detectan alteraciones en el estado de ánimo o malestares.
Nuevo
",home
Elecciones en Venezuela: alertan que los riesgos de manipulación por parte del régimen alcanza al 86% de los centros de votación,https://www.infobae.com/venezuela/2024/06/29/elecciones-en-venezuela-alertan-que-los-riesgos-de-manipulacion-por-parte-del-regimen-alcanza-al-86-de-los-centros-de-votacion/,"A menos de un mes para las elecciones presidenciales en Venezuela, la tensión política comienza a intensificarse con el correr de las horas. El país, golpeado por años de crisis económica y humanitaria, se prepara para un evento que podría cambiar el curso de su historia. Sin embargo, la represión del régimen de Maduro genera dudas sobre la integridad del proceso electoral.
Las amenazas que pesan sobre los comicios son múltiples y complejas. Desde acusaciones de manipulación electoral hasta preocupaciones sobre la transparencia y seguridad del voto, los venezolanos se enfrentan a un panorama incierto.
En este contexto, el sociólogo y doctor en Ciencias Políticas, Héctor Briceño, presentó una investigación, realizada para el Observatorio Global de Comunicación y Democracia, que revela la existencia de riesgos significativos en la mayoría de los centros electorales de Venezuela.
“Son riesgos que provienen de múltiples fuentes, pero que todos convergen en obstaculizar, amenazar, entorpecer el libre ejercicio de la votación que merecen y que tienen garantizados los electores”, aseguró Briceño en conversación con Infobae.
“En concreto, 86% de los centros electorales equivalentes a 12 mil y tantos centros de votación que a su vez contienen más de 18 millones de electores, tienen algún tipo de nivel de riesgo”, agregó.
De acuerdo con el investigador, los estados de Venezuela con mayor número de centros electorales en condición de riesgo son Distrito Capital, Bolívar y Carabobo. Sin embargo, es en los municipios fronterizos del país donde se ha evidenciado con mayor frecuencia que el chavismo opera bajo sospechas de fraude.
“Mientras mayor es el riesgo en el centro electoral, tiende el gobierno a sacar un mayor porcentaje de votación que no se corresponde con el comportamiento de los votos obtenidos por el chavismo en esa misma elección, en el resto de los centros electorales de ese mismo municipio”, afirmó.
Según Briceño “es posible que muchos de esos electores estén votando bajo condiciones de coerción social. Puede ser desde el voto supervisado o el voto asistido, bajo amenazas de pérdida de beneficios sociales, de pérdida de empleo, etcétera”.
Sin embargo aclara que “no porque un centro electoral cumpla una condición de riesgo tiene que obligatoriamente suceder allí, pero sí es probabilístico, es decir, que a mayor riesgo, hay mayores probabilidades que ocurran manipulaciones, amenazas y distorsiones de la voluntad popular en esos centros electorales”.
El análisis de riesgos el día de la elección revela dos principales dimensiones de preocupación, según las conclusiones de la investigación.
La primera dimensión es de carácter administrativo y se refiere a las decisiones tomadas por el Consejo Nacional Electoral (CNE). Estas medidas impactan en cómo se distribuyen los centros de votación en todo el territorio nacional y cómo se asignan los electores a estos centros. Sin embargo, los criterios utilizados por el CNE para tomar estas decisiones no son transparentes, lo que siembra dudas sobre la equidad y la transparencia del proceso.
La segunda dimensión se centra en los riesgos propiamente electorales. Estos riesgos incluyen las estadísticas de participación y abstención, así como la posibilidad de que existan centros electorales donde el dominio de alguna fuerza política, ya sea el gobierno o la oposición, sea excesivo.
De los más de 18 millones de electores que emiten su sufragio en lugares que presentan ciertos niveles de vulnerabilidad electoral, cerca de un millón de personas votan en sitios que enfrentan desafíos administrativos, mientras que unos 16 millones lo hacen en condiciones que implican riesgos electorales. Además, hay alrededor de 1 millón de electores que se ven obligados a votar en centros que acumulan ambos tipos de riesgos.
La crisis migratoria en Venezuela también ha tenido un impacto en el comportamiento electoral del país, al no reflejarse adecuadamente en el Registro Electoral.
A pesar de que se estima que hay aproximadamente 7 millones de migrantes venezolanos, se calcula que al menos 4 millones de ellos están en edad de votar, pero “no todos necesariamente estaban inscritos o se lograron inscribir en esta última jornada”.
Las repercusiones de la migración masiva se reflejan en una disminución de votos en las grandes ciudades, tradicionalmente bastiones de la oposición.
“En las estadísticas de intención de migración, es decir, encuestas que han preguntado a la gente si se quieren ir o no, hemos visto que ha habido ciclos en los que los electores o simpatizantes identificados con la oposición ha sido la que mayoritariamente ha decidido irse”, reveló Briceño.
Sin embargo, afirma que también hay seguidores del chavismo que han decidido huir del país por diversas razones.
“Cuando un chavista se va es que perdió la fe en el gobierno, es que perdió la fe en la revolución y que antes de querer votar por la oposición, decide abandonar el país. Con esto lo que quiero decir es que las repercusiones para el voto opositor son importantes. Son una cantidad de votos que la oposición ha perdido cuando no se les permite votar. Pero también el gobierno perdió una parte importante de su electorado”, afirmó el sociólogo en conversación con Infobae.
“Esto ha tenido una consecuencia importante porque ha reconfigurado el comportamiento electoral venezolano, muy especialmente entre las regiones o el interior del país y las grandes ciudades”, agregó.
La redistribución del voto en Venezuela ha mostrado cambios notables desde 2021, revelando una nueva dinámica en el apoyo a la oposición. Según los resultados de las elecciones regionales de ese año, la oposición perdió una cantidad significativa de votos en las grandes ciudades, pero aumentó su respaldo en regiones rurales del país.
El también doctor en Ciencias Políticas señaló que el perfil del electorado opositor ha cambiado drásticamente en comparación con 2015.
Ahora, el voto opositor se centra más en zonas rurales y menos en áreas urbanas y de clase media.
En cuanto a las posibilidades de una victoria electoral de Nicolás Maduro, Héctor Briceño afirmó que el régimen chavista ya decidió recurrir al fraude para estos comicios.
“El Gobierno ya ha estado recurriendo al fraude, modificando continuamente las condiciones de competencia, desde la propia inhabilitación de la candidata o de las dos candidatas opositoras que se presentaron, María Corina y Corina Yoris, entorpeciendo, eliminando o ilegalizando las tarjetas de buena cantidad de partidos, persiguiendo a líderes y simpatizantes opositores. En fin, creo que sin ninguna de esas medidas que ya ha hecho, y que constituyen una manipulación; un fraude electoral, el gobierno no puede llegar a ser competitivo”.
“Hoy en día parece muy difícil, extremadamente cuesta arriba para el gobierno lograr una victoria popular, ni siquiera utilizando estos mecanismos que ya ha hecho más otros adicionales que tradicionalmente hace, como es el voto asistido, la amenaza y coerción de algunos electores. Pero insisto, creo que aún el escenario no está completo. Creo que aún faltan por ver algunas de las jugadas que tiene preparadas tanto el Gobierno como la oposición”, sentenció.
Nuevo
",home
El reformista Masoud Pezeshkian y el ultraconservador Saeed Jalili se disputarán la presidencia de Irán en un balotaje,https://www.infobae.com/america/mundo/2024/06/29/el-reformista-masoud-pezeshkian-y-el-ultraconservador-saeed-jalili-se-jugaran-la-presidencia-de-iran-en-un-balotaje/,"El reformista Masoud Pezeshkian y el ultraconservador Saeed Jalili se disputarán la presidencia iraní en una segunda vuelta electoral después de que ninguno de los dos candidatos lograse el 50 % de los votos en la primera, informó este sábado la Comisión Electoral del país.
Estas elecciones presidenciales registraron la participación más baja en la historia de la República Islámica de Irán, con solo un 40 % de los votantes que acudieron a las urnas, un dato que muestra el descontento ciudadano por la situación económica y la falta de libertades.
“Ninguno de los candidatos ha obtenido la mayoría absoluta de los votos”, dijo el portavoz de la Comisión Electoral, Mohsen Eslami, en una rueda de prensa televisada.
“Se realizará una segunda vuelta como establece la ley, que será el 5 de julio”, añadió Eslami, quien anunció que votaron 24.535.185 personas, lo que supone el 40 % del electorado.
En las elecciones se ha impuesto el reformista Pezeshkian con 10.415.991 votos que suponen el 42,4 % del total, seguido de cerca por Jalili con 9.473.298 votos o el 38,6 %.
Lejos quedó el que fuera el favorito cuando comenzó la campaña electoral, el pragmático conservador Mohammad Baqer Qalibaf, con 3.383.340 votos, el 13,79 %, y más allá el cuarto candidato es el clérigo Mostafa Pourmohammadi con 206.397 papeletas, el 0,8 %.
Las elecciones se celebran para elegir al sucesor del presidente Ebrahim Raisí, quien murió en un accidente de helicóptero en mayo, junto con otras siete personas.
El presidente iraní tiene capacidad de decisión en cuestiones nacionales y en menor medida en política exterior y de seguridad en Irán, donde Ali Khamenei ejerce de jefe de Estado con vastos poderes.
El cirujano cardíaco Masoud Pezeshkian, ex ministro de Sanidad de 69 años, comenzó la campaña con bajas expectativas pero ha ido ganando peso durante la misma con un mensaje de acercamiento a Occidente y críticas al velo.
Su lema electoral es “Para Irán”, que evoca el título de la canción que se convirtió en el himno de las protestas desatadas por la muerte de Mahsa Amini y cuyo autor Shervin Hajipour fue condenado a casi cuatro años por ello.
Ha recibido el apoyo de los ex presidentes Mohamed Jatamí (1997-2005) y Hasan Rohaní (2013-2021) del bloque reformista -que busca cierta apertura del país- después de que en las presidenciales de 2021 no se permitiese la participación de un moderado, y pertenece a la minoría azerí.
Pezeshkian de hecho ha presentado su hipotético gobierno como un “tercer mandato” de Jatamí, el primer presidente reformista que insufló a Irán ciertos aires de apertura, y con quien entró en política en el año 2000 como ministro de Sanidad.
En el polo opuesto se encuentra Jalili, ex jefe negociador nuclear iraní de 58 años, que ha sido descrito como un “verdadero producto de la Revolución Islámica”, ha ejercido de asesor del líder supremo de Irán, Ali Khamenei, y se muestra opuesto a Occidente.
Jalili es considerado el candidato del statu quo y quien seguirá las políticas del ultraconservador Raisí, bajo cuyo gobierno aumentó la represión.
Las elecciones han registrado la participación más baja en la historia de la República Islámica, que otorga una gran importancia a la participación en las elecciones como muestra de su legitimidad y respaldo popular.
Así, el porcentaje de votos se encuentra por debajo de las anteriores presidenciales de 2021, que registraron un 48 %, y de las parlamentarias de marzo cuando votó un 41 %.
Esta baja participación muestra el nivel de descontento popular por la mala situación económica, la falta de libertades y un profundo desapego a la República Islámica, especialmente entre los jóvenes.
Las repetidas llamadas de Khamenei a votar “por la continuación, la fortaleza, dignidad y el honor de la República Islámica” parece que han caído en saco roto.
Si las autoridades consideran votar como una muestra de apoyo, muchos iraníes creen que la abstención es una forma de protesta y de restar legitimidad al sistema islámico.
(EFE)
Nuevo
",home
"El profundo dolor de Miguel Romano: murió Mercedes, su compañera de vida y madre de su hija",https://www.infobae.com/teleshow/2024/06/29/el-profundo-dolor-de-miguel-romano-murio-mercedes-su-companera-de-vida-y-madre-de-su-unica-hija/,"Miguel Romano transita un momento de profundo dolor por la muerte de Mercedes López Paredes, su compañera de toda la vida y madre de su única hija, Paola. De acuerdo a lo que había informado el reconocido estilista, Meme, como todos llamaban a su esposa, tenía 85 años y venía luchando contra una dura enfermedad. Su fallecimiento golpeó al entorno familiar tanto como al del espectáculo, que expresó las condolencias para el coiffeur y a su círculo íntimo.
Si bien su cuadro era delicado, la noticia trascendió a partir de una publicación de Graciela Borges. La gran actriz argentina, amiga de Romano y de su familia, subió a sus historias de Instagram una foto de Mercedes con un mensaje de despedida: “Vas a estar en mi corazón para siempre, te amo”, escribió Graciela, mencionando en la publicación al estilista y a su hija. 
En una entrevista reciente, y mientras hablaba de su polémica con Susana Giménez, su histórica musa, Romano se había referido al delicado cuadro de Mercedes. “Mi mujer está muy, muy enferma. Las dos cosas se me suman. Seguí trabajando porque tengo una familia que mantener, tengo una hija, una nieta. Y voy a seguir trabajando hasta el día que me muera”, enfatizó semanas atrás en declaraciones a Mañanísima (El Trece).
En LAM (América), compartieron la información con un breve repaso por la historia de amor que lleva más de 65 años y que nació de casualidad. Ella trabajaba de niñera cerca de una peluquería en Villa Urquiza. Sin saberlo, estaba por entrar a una nueva vida, en la que permaneció hasta su final. “Vino una chica y le dije ‘quedate en la peluquería que te van a hacer manos’. Le corté una, dos, tres veces el pelo y empecé a salir con ella”, le contó el coiffeur a Myriam Bunin en su programa Con estilo.
Mercedes empezó a trabajar como manicura pero su belleza hizo que el salón le quedara chico. El camino al modelaje modelaje o la actuación parecía inevitable. “Fuimos a un concurso que escuchábamos poruna radio enorme”, continuó Romano. Las revistas de la época buscaban a Miss Fotogenia y Meme quedó preseleccionada entre 1800 chicas. Pasaron seis meses, siguió sorteando instancias y estuvo entre las diez que llegaron a la final. Y cuando Miguelito había perdido las esperanzas, escuchó el nombre de su novia entre trompetas de júbilo.
Miguel y Mercedes no se separaron más, y su trabajo le abrió las puertas de la fama, un camino que empezó con Tita Merello y luego estuvo a la vista de todos. Meme vio como pasaban por las manos de su marido las figuras más impactantes del espectáculo nacional. Susana y Graciela, claro. Pero también Nélida Roca, Isabel Sarli, Moria Casán y siguen las firmas. “Mercedes nunca fue celosa de mi trabajo, siempre fue muy humilde”, sentenció Miguelito para resumir a su compañera eterna.
Mercedes nació en España y llegó al país de muy chica, huyendo de guerra civil, como tantos compatriotas de aquella época y con la familia desperdigada. Ella se afincó primero en Belgrano para hacer tiempo, hasta que lograron unirse todos en Villa Urquiza. Y en una entrevista con La Nación, dio su versión del encuentro que le cambió la vida. 
“Yo trabajaba como niñera en la casa de un médico y en forma paralela, empecé a estudiar flamenco en una escuela de danzas. Amaba esa danza, bailaba la jota desde muy niña y era mi sueño seguir aprendiendo. Una tarde, en ese mismo lugar, me lo crucé a Miguel, que solía hacer gimnasia. Éramos dos adolescentes, él tenía 18 años y yo 14. Me preguntó qué hacía, le conté que cuidaba niños, que amaba el flamenco. ‘Venite a trabajar a mi peluquería’”, me dijo”. 
Ella aceptó y entró a un mundo en el que todo estaba por escribirse. Mientras hacía manicura, Mercedes admiraba el profesionalismo y la pasión con la que trabajaba Miguel. Al poco tiempo se pusieron de novios y no se separaron más. Se casaron en 1958, ella fue testigo como aquel atelier improvisado de Urquiza mutó en el salón por el que desfilaron los más grandes del espectáculo. Y ella fue parte clave de ese engranaje, que sostuvo hasta que ya no pudo más.
Nuevo
",home
